{
  "acs_version": "0.1",
  "packet_id": "550e8400-e29b-41d4-a716-446655440000",
  "agent_id": "agent-researcher-01",
  "timestamp": "2026-06-16T12:00:00Z",
  "intent": {
    "action": "send_email",
    "target": "team@company.com",
    "scope": "weekly_update"
  },
  "evidence": {
    "sources": [
      {
        "hash": "sha256:recip123",
        "type": "recipient",
        "verified": true
      },
      {
        "hash": "sha256:content456",
        "type": "content",
        "verified": true
      }
    ],
    "evidence_gap": 0.0
  },
  "risk": {
    "level": "low",
    "categories": [
      "communication"
    ],
    "blast_radius": "single_user"
  },
  "confidence": 0.95,
  "policy": {
    "required_signoff": false,
    "max_risk_level": "medium",
    "evidence_gap_threshold": 0.3,
    "jurisdiction": "EU-GDPR"
  },
  "decision": "ALLOW",
  "signature": "ed25519:placeholder"
}