{
  "acs_version": "0.1",
  "packet_id": "550e8400-e29b-41d4-a716-446655440001",
  "agent_id": "agent-coder-02",
  "timestamp": "2026-06-16T12:00:00Z",
  "intent": {
    "action": "execute_code",
    "target": "production_db",
    "scope": "migration_script"
  },
  "evidence": {
    "sources": [
      {
        "hash": "sha256:code789",
        "type": "code_review",
        "verified": true
      }
    ],
    "evidence_gap": 0.67
  },
  "risk": {
    "level": "medium",
    "categories": [
      "data_integrity"
    ],
    "blast_radius": "organization"
  },
  "confidence": 0.75,
  "policy": {
    "required_signoff": false,
    "max_risk_level": "high",
    "evidence_gap_threshold": 0.3,
    "jurisdiction": "EU-GDPR"
  },
  "decision": "DEFER",
  "signature": "ed25519:placeholder"
}